{
  "provenance_schema_version": 4,
  "cast_target": "claude",
  "mold": {
    "name": "interview-to-freeform-summary",
    "path": "content/molds/interview-to-freeform-summary/index.md",
    "revision": 3,
    "content_hash": "19864b16965d5b644be5a6a712696211326cfa6099a3084bae3eb79271b56f7d",
    "commit": "63a3f9cf9c97a637fe1628d298e524f35709e289"
  },
  "cast_at": "2026-09-13T20:58:28.210Z",
  "refs": [],
  "artifacts": {
    "produces": [
      {
        "id": "freeform-summary",
        "kind": "markdown",
        "default_filename": "freeform-summary.md",
        "description": "Methods, tools, sample data, references, constraints, open questions, and workflow intent gathered from a user interview."
      }
    ],
    "consumes": []
  }
}
