{
  "provenance_schema_version": 4,
  "cast_target": "claude",
  "mold": {
    "name": "implement-cwl-tool-step",
    "path": "content/molds/implement-cwl-tool-step/index.md",
    "revision": 2,
    "content_hash": "7d82c631c885eb9a1bb2039411b5ebc9fa5ec5fc88507f42e60836b7efc26f65",
    "commit": "63a3f9cf9c97a637fe1628d298e524f35709e289"
  },
  "cast_at": "2026-09-13T20:58:28.002Z",
  "refs": [],
  "artifacts": {
    "produces": [
      {
        "id": "cwl-workflow-draft",
        "kind": "yaml",
        "default_filename": "cwl-workflow-draft.cwl",
        "description": "CWL Workflow skeleton with one more abstract step replaced by a concrete CommandLineTool step (loop iteration output)."
      }
    ],
    "consumes": [
      {
        "id": "cwl-tool-summary",
        "description": "Compact CWL tool summary from [[summarize-cwl-tool]]; binds the abstract step to a concrete CommandLineTool.",
        "producers": [
          "summarize-cwl-tool"
        ]
      },
      {
        "id": "cwl-workflow-draft",
        "description": "CWL Workflow skeleton being filled in step by step; the step replaces a placeholder in this draft.",
        "producers": [
          "implement-cwl-tool-step",
          "summary-to-cwl-template"
        ]
      }
    ]
  }
}
