{
  "provenance_schema_version": 4,
  "cast_target": "claude",
  "mold": {
    "name": "implement-cwl-workflow-test",
    "path": "content/molds/implement-cwl-workflow-test/index.md",
    "revision": 2,
    "content_hash": "2c469abfe468ac506380d22ecb43f9dce35affd8a674b079f04f63f29d267224",
    "commit": "63a3f9cf9c97a637fe1628d298e524f35709e289"
  },
  "cast_at": "2026-09-13T20:58:28.042Z",
  "refs": [],
  "artifacts": {
    "produces": [
      {
        "id": "cwl-workflow-test",
        "kind": "yaml",
        "default_filename": "cwl-job.yml",
        "description": "CWL job file(s) with inputs and expected-output assertions for the implemented workflow."
      }
    ],
    "consumes": [
      {
        "id": "cwl-test-plan",
        "description": "Reviewable CWL test plan from [[nextflow-test-to-cwl-test-plan]] (or future CWL test-plan producers); job, fixture, assertion provenance.",
        "producers": [
          "nextflow-test-to-cwl-test-plan"
        ]
      },
      {
        "id": "cwl-workflow-draft",
        "description": "CWL Workflow being tested; provides input/output ports and shapes the job + assertions must match.",
        "producers": [
          "implement-cwl-tool-step",
          "summary-to-cwl-template"
        ]
      }
    ]
  }
}
