{
  "provenance_schema_version": 4,
  "cast_target": "claude",
  "mold": {
    "name": "nextflow-summary-to-cwl-data-flow",
    "path": "content/molds/nextflow-summary-to-cwl-data-flow/index.md",
    "revision": 1,
    "content_hash": "68a75d5f934610fd9bf95434c94c3965dc2c591ea33160e911a3662f1f290aaa",
    "commit": "990978bbe2b62e0a5d0092b18ff0741371705c78"
  },
  "cast_at": "2026-09-15T18:32:07.411Z",
  "refs": [
    {
      "kind": "schema",
      "mode": "verbatim",
      "ref": "[[summary-nextflow]]",
      "src": "package://@galaxy-foundry/summarize-nextflow#summaryNextflowSchema",
      "dst": "references/schemas/summary-nextflow.schema.json",
      "used_at": "runtime",
      "load": "upfront",
      "evidence": "corpus-observed",
      "purpose": "Read process, channel, operator, and fixture structure while drafting CWL-facing abstract data flow.",
      "license": "MIT",
      "src_hash": "0f4a3d3616d514aca0fd3ae6918e2de8bbc1ea52daf8df957b39cf70e32d5595",
      "dst_hash": "0f4a3d3616d514aca0fd3ae6918e2de8bbc1ea52daf8df957b39cf70e32d5595",
      "source": "deterministic"
    }
  ],
  "artifacts": {
    "produces": [
      {
        "id": "nextflow-cwl-data-flow",
        "kind": "markdown",
        "default_filename": "nextflow-cwl-data-flow.md",
        "description": "Reviewable Markdown brief: abstract topology, scatter/gather choices, value transformations, unresolved CommandLineTool needs, confidence."
      }
    ],
    "consumes": [
      {
        "id": "summary-nextflow",
        "description": "Structured Nextflow pipeline summary emitted by [[summarize-nextflow]]; consumed alongside the CWL interface brief.",
        "inherited_schema": "[[summary-nextflow]]",
        "producers": [
          "summarize-nextflow"
        ]
      },
      {
        "id": "nextflow-cwl-interface",
        "description": "Preceding CWL interface brief from [[nextflow-summary-to-cwl-interface]] that pins inputs, outputs, and labels.",
        "producers": [
          "nextflow-summary-to-cwl-interface"
        ]
      }
    ]
  }
}
