{
  "provenance_schema_version": 4,
  "cast_target": "claude",
  "mold": {
    "name": "nextflow-to-test-data",
    "path": "content/molds/nextflow-to-test-data/index.md",
    "revision": 4,
    "content_hash": "842e097edfb5bfbc37b62a35d5870ee2087df33919212a7965fd70dae799b189",
    "commit": "2f8792a62ca53f074605ddbcfb25e75871f52b24"
  },
  "cast_at": "2026-10-22T03:17:31.139Z",
  "refs": [
    {
      "kind": "research",
      "mode": "verbatim",
      "ref": "[[component-nextflow-testing]]",
      "src": "content/research/component-nextflow-testing/index.md",
      "dst": "references/notes/component-nextflow-testing.md",
      "used_at": "runtime",
      "load": "on-demand",
      "evidence": "hypothesis",
      "purpose": "Interpret nf-test profiles and fixture conventions before mapping declared fixtures onto Galaxy inputs.",
      "trigger": "When `test_selection` requires a scope choice or the selected candidate does not cover every workflow input.",
      "verification": "Map nf-core/bacass declared fixtures onto its Galaxy interface and confirm this note improves profile/fixture selection.",
      "src_hash": "1a429a25165e8ab3621aaef1c481db563f6280bf1f090b5257f937805346bc67",
      "dst_hash": "1a429a25165e8ab3621aaef1c481db563f6280bf1f090b5257f937805346bc67",
      "source": "deterministic"
    },
    {
      "kind": "research",
      "mode": "verbatim",
      "ref": "[[component-nextflow-testing]]",
      "src": "content/research/component-nextflow-testing/component-nextflow-testing.yml",
      "dst": "references/notes/component-nextflow-testing.yml",
      "used_at": "runtime",
      "load": "on-demand",
      "evidence": "hypothesis",
      "purpose": "Interpret nf-test profiles and fixture conventions before mapping declared fixtures onto Galaxy inputs.",
      "trigger": "When `test_selection` requires a scope choice or the selected candidate does not cover every workflow input.",
      "companion_of": "references/notes/component-nextflow-testing.md",
      "src_hash": "7d4da038c82a7da9b4abf4a6cdd8480f73a235e155c8d9763d6bd3826acf818e",
      "dst_hash": "7d4da038c82a7da9b4abf4a6cdd8480f73a235e155c8d9763d6bd3826acf818e",
      "source": "deterministic"
    },
    {
      "kind": "research",
      "mode": "verbatim",
      "ref": "[[galaxy-workflow-testability-design]]",
      "src": "content/research/galaxy-workflow-testability-design/index.md",
      "dst": "references/notes/galaxy-workflow-testability-design.md",
      "used_at": "runtime",
      "load": "on-demand",
      "evidence": "corpus-observed",
      "purpose": "Map each declared fixture to an addressable Galaxy input label and the collection shape it must populate.",
      "trigger": "When mapping a declared fixture (often a samplesheet-driven input) onto a Galaxy input's collection shape.",
      "src_hash": "c7dc5421bdd35af8000e61e618c813e162889416a0f322f8d0cb24a66ccad153",
      "dst_hash": "c7dc5421bdd35af8000e61e618c813e162889416a0f322f8d0cb24a66ccad153",
      "source": "deterministic"
    },
    {
      "kind": "research",
      "mode": "verbatim",
      "ref": "[[iwc-test-data-conventions]]",
      "src": "content/research/iwc-test-data-conventions/index.md",
      "dst": "references/notes/iwc-test-data-conventions.md",
      "used_at": "runtime",
      "load": "on-demand",
      "evidence": "corpus-observed",
      "purpose": "Express each ref remote-URL-first with SHA-1 integrity and per-input collection layout when recording resolved fixtures.",
      "trigger": "When writing each `test-data-refs` entry.",
      "src_hash": "b7ef14132a0b40f626fff98fde44234ce5c848b6a3c255f4748b803c9a44b074",
      "dst_hash": "b7ef14132a0b40f626fff98fde44234ce5c848b6a3c255f4748b803c9a44b074",
      "source": "deterministic"
    },
    {
      "kind": "schema",
      "mode": "verbatim",
      "ref": "[[summary-nextflow]]",
      "src": "package://@galaxy-foundry/summarize-nextflow#summaryNextflowSchema",
      "dst": "references/schemas/summary-nextflow.schema.json",
      "used_at": "runtime",
      "load": "upfront",
      "evidence": "corpus-observed",
      "purpose": "Input contract: read `test_selection` and the chosen `test_candidates[].inputs[]` — role, url/path, sha1, filetype — as the declared source of test data.",
      "license": "MIT",
      "src_hash": "839e11b1892af74df3158377027e7d340a67dafdb9b5965d79e9715a1a109d54",
      "dst_hash": "839e11b1892af74df3158377027e7d340a67dafdb9b5965d79e9715a1a109d54",
      "source": "deterministic"
    },
    {
      "kind": "schema",
      "mode": "verbatim",
      "ref": "[[test-data-refs]]",
      "src": "package://@galaxy-foundry/gxwf-foundry#testDataRefsSchema",
      "dst": "references/schemas/test-data-refs.schema.json",
      "used_at": "runtime",
      "load": "upfront",
      "evidence": "cast-validated",
      "purpose": "Output contract: one ref per workflow input, resolved or an honest gap with a reason. Cast bundles the JSON Schema; validate with `foundry validate-test-data-refs` before returning.",
      "verification": "Run the test-data-resolution chain on a pinned scenario and confirm each leg's test-data-refs.json validates and implement-galaxy-workflow-test stages from it.",
      "license": "MIT",
      "src_hash": "534dcb2f44e24a33bd59de2bca8d882af97321c602cf1b66776c22c38b0207a8",
      "dst_hash": "534dcb2f44e24a33bd59de2bca8d882af97321c602cf1b66776c22c38b0207a8",
      "source": "deterministic"
    }
  ],
  "artifacts": {
    "produces": [
      {
        "id": "test-data-refs",
        "kind": "json",
        "default_filename": "test-data-refs.json",
        "schema": "[[test-data-refs]]",
        "description": "Test data resolved from the pipeline's declared fixtures, expressed as URLs/paths plus expected shapes for downstream test authoring. Shared id with [[find-test-data]] — the branch's search fallback fills only the inputs this Mold leaves unresolved."
      }
    ],
    "consumes": [
      {
        "id": "summary-nextflow",
        "description": "Structured Nextflow summary from [[summarize-nextflow]]; carries the enumerated `test_candidates[]` and explicit `test_selection`, with each candidate input represented by a role plus url/path, sha1, and filetype.",
        "inherited_schema": "[[summary-nextflow]]",
        "producers": [
          "summarize-nextflow"
        ]
      },
      {
        "id": "nextflow-galaxy-interface",
        "description": "Galaxy interface brief from [[nextflow-summary-to-galaxy-interface]] pinning the workflow input labels, collection shapes, and datatypes each resolved fixture must map onto.",
        "producers": [
          "nextflow-summary-to-galaxy-interface"
        ]
      }
    ]
  }
}
