{
  "provenance_schema_version": 4,
  "cast_target": "claude",
  "mold": {
    "name": "implement-galaxy-workflow-test",
    "path": "content/molds/implement-galaxy-workflow-test/index.md",
    "revision": 11,
    "content_hash": "6cb4f93b73dd9638a9f74673d215b54bc6e4c55736108411f08a43400581571d",
    "commit": "d4a0c56ce1b50069c458a891065ff4ee0232abb1"
  },
  "cast_at": "2026-10-21T00:33:48.323Z",
  "cast_date": "2026-07-20",
  "cast_revision": 1,
  "cast_history": [
    {
      "rev": 1,
      "date": "2026-07-20",
      "note": "planemo 0.75.45"
    }
  ],
  "refs": [
    {
      "kind": "cli-command",
      "mode": "sidecar",
      "ref": "[[validate-tests]]",
      "src": "content/cli/gxwf/validate-tests.md",
      "dst": "references/cli/validate-tests.json",
      "used_at": "runtime",
      "load": "on-demand",
      "evidence": "corpus-observed",
      "purpose": "Run the cheap static workflow-test validation and workflow-label cross-check before Planemo execution.",
      "trigger": "After authoring or editing a Galaxy workflow test file and before Planemo invocation.",
      "src_hash": "7157ef7750ead142086e0597d52d2ef6ef072e8ec2939f2ac6965bdccf04849d",
      "dst_hash": "973184698733ffb86bb5a15781902846afec311047f5684f779f8ad023e5d24c",
      "source": "deterministic"
    },
    {
      "kind": "cli-tool",
      "mode": "verbatim",
      "ref": "[[planemo]]",
      "src": "content/cli/planemo/index.md",
      "dst": "references/cli/planemo.md",
      "used_at": "runtime",
      "load": "upfront",
      "evidence": "corpus-observed",
      "purpose": "Runtime for workflow_test_init / workflow_test_on_invocation; install before authoring tests against a live invocation.",
      "src_hash": "12e8cac3ffb4ab7f007ced7a8d4f01e6b3785d06a55926496bbacc0a8f3fc5c5",
      "dst_hash": "12e8cac3ffb4ab7f007ced7a8d4f01e6b3785d06a55926496bbacc0a8f3fc5c5",
      "source": "deterministic"
    },
    {
      "kind": "research",
      "mode": "verbatim",
      "ref": "[[galaxy-workflow-testability-design]]",
      "src": "content/research/galaxy-workflow-testability-design/index.md",
      "dst": "references/notes/galaxy-workflow-testability-design.md",
      "used_at": "runtime",
      "load": "on-demand",
      "evidence": "corpus-observed",
      "purpose": "Revise workflow inputs, outputs, labels, checkpoints, and collection identifiers so meaningful tests can be authored.",
      "trigger": "When test authoring reveals missing labels, omitted workflow-level outputs, unstable collection identifiers, weakly assertable final outputs, or fixture-shape pressure on workflow inputs.",
      "src_hash": "c7dc5421bdd35af8000e61e618c813e162889416a0f322f8d0cb24a66ccad153",
      "dst_hash": "c7dc5421bdd35af8000e61e618c813e162889416a0f322f8d0cb24a66ccad153",
      "source": "deterministic"
    },
    {
      "kind": "research",
      "mode": "verbatim",
      "ref": "[[iwc-shortcuts-anti-patterns]]",
      "src": "content/research/iwc-shortcuts-anti-patterns/index.md",
      "dst": "references/notes/iwc-shortcuts-anti-patterns.md",
      "used_at": "runtime",
      "load": "on-demand",
      "evidence": "corpus-observed",
      "purpose": "Flag assertion shortcuts that are acceptable in IWC versus shortcuts that should be avoided.",
      "trigger": "When considering existence-only, size-only, image-only, checksum, output-label, or negative-test patterns.",
      "src_hash": "b3f691a59751114ab67588832ba978052ab2be2ab5ef775737177ad45d7bdc45",
      "dst_hash": "b3f691a59751114ab67588832ba978052ab2be2ab5ef775737177ad45d7bdc45",
      "source": "deterministic"
    },
    {
      "kind": "research",
      "mode": "verbatim",
      "ref": "[[iwc-test-data-conventions]]",
      "src": "content/research/iwc-test-data-conventions/index.md",
      "dst": "references/notes/iwc-test-data-conventions.md",
      "used_at": "runtime",
      "load": "on-demand",
      "evidence": "corpus-observed",
      "purpose": "Assemble job input fixtures, remote URLs, hashes, collection shapes, and test-data layout in IWC style.",
      "trigger": "When writing or revising the job/input side of a Galaxy workflow test file.",
      "src_hash": "d2a3f38968204ea6344a6948e6e834c717867c6ba0c5140b2650fd4731bece5f",
      "dst_hash": "d2a3f38968204ea6344a6948e6e834c717867c6ba0c5140b2650fd4731bece5f",
      "source": "deterministic"
    },
    {
      "kind": "research",
      "mode": "verbatim",
      "ref": "[[planemo-asserts-idioms]]",
      "src": "content/research/planemo-asserts-idioms/index.md",
      "dst": "references/notes/planemo-asserts-idioms.md",
      "used_at": "runtime",
      "load": "on-demand",
      "evidence": "corpus-observed",
      "purpose": "Choose assertion families, tolerance magnitudes, and the static/Planemo validation loop.",
      "trigger": "When writing or revising output assertions for a Galaxy workflow test file.",
      "src_hash": "4da914a226c93cca8a1cc2823043429c05da712e3ef051724d15959a7aef5b09",
      "dst_hash": "4da914a226c93cca8a1cc2823043429c05da712e3ef051724d15959a7aef5b09",
      "source": "deterministic"
    },
    {
      "kind": "research",
      "mode": "verbatim",
      "ref": "[[planemo-workflow-test-architecture]]",
      "src": "content/research/planemo-workflow-test-architecture/index.md",
      "dst": "references/notes/planemo-workflow-test-architecture.md",
      "used_at": "runtime",
      "load": "on-demand",
      "evidence": "corpus-observed",
      "purpose": "Write tests with stable labels and artifacts that Planemo can connect back to Galaxy invocations, jobs, and outputs.",
      "trigger": "When adding or revising workflow tests that will be iterated with Planemo or generated from existing invocations.",
      "src_hash": "d6ac347c8361d6c312c64c1197426673e53aa1c5577e1c72f1c80a20ccd1cce3",
      "dst_hash": "d6ac347c8361d6c312c64c1197426673e53aa1c5577e1c72f1c80a20ccd1cce3",
      "source": "deterministic"
    },
    {
      "kind": "schema",
      "mode": "verbatim",
      "ref": "[[galaxy-workflow-test-plan]]",
      "src": "package://@galaxy-foundry/gxwf-foundry#galaxyWorkflowTestPlanSchema",
      "dst": "references/schemas/galaxy-workflow-test-plan.schema.json",
      "used_at": "runtime",
      "load": "upfront",
      "evidence": "hypothesis",
      "purpose": "Input contract: read the schema-valid Galaxy test plan (job inputs, expected outputs, assertion intent, tolerances, label assumptions, unresolved mappings, omissions) and convert it into tests-format output, reconciling assumed labels and fixtures against the real draft.",
      "verification": "Consume a cast test plan from a *-test-to-galaxy-test-plan Mold and confirm tests-format output can be authored from it without re-reading the source summary.",
      "license": "MIT",
      "src_hash": "325e9cf1bb5e075fa818dc68868647de95389ca8df8581ee8cf1e2be61196e37",
      "dst_hash": "325e9cf1bb5e075fa818dc68868647de95389ca8df8581ee8cf1e2be61196e37",
      "source": "deterministic"
    },
    {
      "kind": "schema",
      "mode": "verbatim",
      "ref": "[[tests-format]]",
      "src": "package://@galaxy-foundry/gxwf-foundry#testsFormatSchema",
      "dst": "references/schemas/tests-format.schema.json",
      "used_at": "runtime",
      "load": "upfront",
      "evidence": "corpus-observed",
      "purpose": "JSON Schema contract for the Galaxy workflow test format. Output of this Mold must validate against it.",
      "license": "MIT",
      "license_file": "LICENSES/galaxy-tool-util-ts.LICENSE",
      "src_hash": "ff0de5041f4c3de0ab7abe9e7555c5a7120665b077f42661461301b0fb26f372",
      "dst_hash": "ff0de5041f4c3de0ab7abe9e7555c5a7120665b077f42661461301b0fb26f372",
      "source": "deterministic",
      "license_file_hash": "383450c494c01c466bcf22df102540a39ac89da50563fd7be686ba06772f96b3"
    }
  ],
  "artifacts": {
    "produces": [
      {
        "id": "galaxy-workflow-test",
        "kind": "yaml",
        "default_filename": "galaxy-workflow.gxwf-tests.yml",
        "description": "Galaxy workflow test file (tests-format) with job inputs, expected outputs, assertions; passes static schema + label cross-check. Named as the workflow basename + `-tests.yml` so Planemo discovers it as the companion of `galaxy-workflow.gxwf.yml`."
      }
    ],
    "consumes": [
      {
        "id": "galaxy-test-plan",
        "description": "Schema-valid Galaxy test plan ([[galaxy-workflow-test-plan]]) from a *-test-to-galaxy-test-plan Mold; carries job inputs, expected outputs, assertion intent, fixture provenance, label assumptions, unresolved mappings, and omissions.",
        "inherited_schema": "[[galaxy-workflow-test-plan]]",
        "producers": [
          "changeset-to-galaxy-test-plan",
          "cwl-test-to-galaxy-test-plan",
          "freeform-summary-to-galaxy-test-plan",
          "nextflow-test-to-galaxy-test-plan",
          "workflow-brief-to-galaxy-test-plan"
        ]
      },
      {
        "id": "galaxy-workflow",
        "description": "Concrete gxformat2 workflow being tested — the loop-endstate `galaxy-workflow.gxwf.yml` from [[advance-galaxy-draft-step]] (`class: GalaxyWorkflow`); provides the real input/output labels, outputs, and collection shapes the test must assert against.",
        "producers": [
          "advance-galaxy-draft-step",
          "mature-galaxy-workflow-for-iwc"
        ]
      },
      {
        "id": "test-data-refs",
        "description": "Resolved test data references (URLs, paths, expected shapes) from paper-to-test-data or find-test-data.",
        "inherited_schema": "[[test-data-refs]]",
        "producers": [
          "cwl-to-test-data",
          "find-test-data",
          "nextflow-to-test-data",
          "paper-to-test-data"
        ]
      }
    ]
  }
}
