{
  "provenance_schema_version": 4,
  "cast_target": "claude",
  "mold": {
    "name": "find-test-data",
    "path": "content/molds/find-test-data/index.md",
    "revision": 9,
    "content_hash": "82e774ca6a49c3bcca2e78c89a6abf4c423f39ef2826ce965da535aedb99694f",
    "commit": "f264e5886afef3f6decec636f40afa4f2fe926bd"
  },
  "cast_at": "2026-10-21T22:37:49.169Z",
  "refs": [
    {
      "kind": "research",
      "mode": "verbatim",
      "ref": "[[galaxy-workflow-testability-design]]",
      "src": "content/research/galaxy-workflow-testability-design/index.md",
      "dst": "references/notes/galaxy-workflow-testability-design.md",
      "used_at": "runtime",
      "load": "on-demand",
      "evidence": "corpus-observed",
      "purpose": "Confirm the collection shapes and labels the resolved data must populate so downstream tests can address them.",
      "trigger": "When mapping an input label in the data-flow brief to a concrete file or collection of files.",
      "src_hash": "c7dc5421bdd35af8000e61e618c813e162889416a0f322f8d0cb24a66ccad153",
      "dst_hash": "c7dc5421bdd35af8000e61e618c813e162889416a0f322f8d0cb24a66ccad153",
      "source": "deterministic"
    },
    {
      "kind": "research",
      "mode": "verbatim",
      "ref": "[[iwc-test-data-conventions]]",
      "src": "content/research/iwc-test-data-conventions/index.md",
      "dst": "references/notes/iwc-test-data-conventions.md",
      "used_at": "runtime",
      "load": "on-demand",
      "evidence": "corpus-observed",
      "purpose": "Match IWC test-data conventions — Zenodo/remote-URL first, SHA-1 integrity, per-input collection layout — when selecting or describing candidate fixtures.",
      "trigger": "When choosing where test data should come from or describing the shape a candidate file must have.",
      "src_hash": "d2a3f38968204ea6344a6948e6e834c717867c6ba0c5140b2650fd4731bece5f",
      "dst_hash": "d2a3f38968204ea6344a6948e6e834c717867c6ba0c5140b2650fd4731bece5f",
      "source": "deterministic"
    },
    {
      "kind": "schema",
      "mode": "verbatim",
      "ref": "[[test-data-refs]]",
      "src": "package://@galaxy-foundry/gxwf-foundry#testDataRefsSchema",
      "dst": "references/schemas/test-data-refs.schema.json",
      "used_at": "runtime",
      "load": "upfront",
      "evidence": "cast-validated",
      "purpose": "Output contract: one ref per workflow input, resolved or an honest gap with a reason. Cast bundles the JSON Schema; validate with `foundry validate-test-data-refs` before returning.",
      "verification": "Run the test-data-resolution chain on a pinned scenario and confirm each leg's test-data-refs.json validates and implement-galaxy-workflow-test stages from it.",
      "license": "MIT",
      "src_hash": "534dcb2f44e24a33bd59de2bca8d882af97321c602cf1b66776c22c38b0207a8",
      "dst_hash": "534dcb2f44e24a33bd59de2bca8d882af97321c602cf1b66776c22c38b0207a8",
      "source": "deterministic"
    }
  ],
  "artifacts": {
    "produces": [
      {
        "id": "test-data-refs",
        "kind": "json",
        "default_filename": "test-data-refs.json",
        "schema": "[[test-data-refs]]",
        "description": "Test data matched from IWC fixtures or public sources, expressed as URLs/paths plus expected shapes for downstream test authoring. Carries forward, unchanged, every entry an earlier leg resolved."
      }
    ],
    "consumes": [
      {
        "id": "workflow-brief",
        "description": "Reviewed Workflow Brief when running the brief-driven Galaxy path; mine only its selected input and fixture requirements.",
        "optional": true,
        "inherited_schema": "[[workflow-brief-schema]]",
        "producers": [
          "freeform-summary-to-workflow-brief",
          "nextflow-summary-to-workflow-brief"
        ]
      },
      {
        "id": "freeform-summary",
        "description": "Source summary from [[summarize-paper]] / [[interview-to-freeform-summary]]; mine its sample-data, public-data-candidate, accession, and data-sizing guidance — this is where the source's dataset evidence lives (the design briefs strip it).",
        "optional": true,
        "producers": [
          "interview-to-freeform-summary",
          "summarize-paper"
        ]
      },
      {
        "id": "summary-nextflow",
        "description": "Source summary from [[summarize-nextflow]]; mine its test candidate set, explicit selection, and sample-data evidence when running the NEXTFLOW → GALAXY pipeline.",
        "optional": true,
        "inherited_schema": "[[summary-nextflow]]",
        "producers": [
          "summarize-nextflow"
        ]
      },
      {
        "id": "summary-cwl",
        "description": "Source summary from [[summarize-cwl]]; mine its test-data / sample-data evidence when running the CWL → GALAXY pipeline.",
        "optional": true,
        "inherited_schema": "[[summary-cwl]]",
        "producers": [
          "summarize-cwl"
        ]
      },
      {
        "id": "workflow-brief-galaxy-interface",
        "description": "Galaxy interface brief from [[workflow-brief-to-galaxy-interface]] pinning input labels, collection shapes, and datatypes for a Workflow-Brief-driven Galaxy path, including the direct PAPER / INTERVIEW → GALAXY pipelines.",
        "producers": [
          "workflow-brief-to-galaxy-interface"
        ]
      },
      {
        "id": "nextflow-galaxy-interface",
        "description": "Galaxy interface brief from [[nextflow-summary-to-galaxy-interface]] pinning input labels, collection shapes, and datatypes for the NEXTFLOW → GALAXY pipeline.",
        "producers": [
          "nextflow-summary-to-galaxy-interface"
        ]
      },
      {
        "id": "cwl-galaxy-interface",
        "description": "Galaxy interface brief from [[cwl-summary-to-galaxy-interface]] pinning input labels, collection shapes, and datatypes for the CWL → GALAXY pipeline.",
        "producers": [
          "cwl-summary-to-galaxy-interface"
        ]
      },
      {
        "id": "test-data-refs",
        "description": "Refs from the chain's source-specific leg ([[nextflow-to-test-data]], [[cwl-to-test-data]], [[paper-to-test-data]]) when the pipeline has one. Keep its resolved entries unchanged and search only for its unresolved inputs. Absent when this Mold is the chain's first leg.",
        "optional": true,
        "inherited_schema": "[[test-data-refs]]",
        "producers": [
          "cwl-to-test-data",
          "find-test-data",
          "nextflow-to-test-data",
          "paper-to-test-data"
        ]
      }
    ]
  }
}
