{
  "provenance_schema_version": 4,
  "cast_target": "claude",
  "mold": {
    "name": "report-foundry-run-feedback",
    "path": "content/molds/report-foundry-run-feedback/index.md",
    "revision": 1,
    "content_hash": "cffa8d8103479a92dd7282c6964cccfb7fb73d95f673f52e53e7743a2cb270da",
    "commit": "63a3f9cf9c97a637fe1628d298e524f35709e289"
  },
  "cast_at": "2026-09-13T20:58:29.656Z",
  "refs": [],
  "artifacts": {
    "produces": [
      {
        "id": "foundry-run-review",
        "kind": "markdown",
        "default_filename": "foundry-run-review.md",
        "description": "Run coverage, ledger integrity findings, dispositions, and a concise summary of feedback triage results."
      },
      {
        "id": "foundry-issue-drafts",
        "kind": "markdown",
        "default_filename": "foundry-issue-drafts.md",
        "description": "One self-contained new-issue or existing-issue comment draft per surviving canonical subject cluster."
      }
    ],
    "consumes": [
      {
        "id": "foundry-feedback-ledger",
        "description": "Runtime-produced ledger containing run coverage and actionable observations about canonical Foundry source assets.",
        "producers": [
          "runtime:feedback"
        ]
      }
    ]
  }
}
