{
  "provenance_schema_version": 4,
  "cast_target": "claude",
  "mold": {
    "name": "nextflow-summary-to-workflow-brief",
    "path": "content/molds/nextflow-summary-to-workflow-brief/index.md",
    "revision": 2,
    "content_hash": "d348d69a7a7a0bb660ff066632624cd9e0ad83c7a7b8eabe38f6810a4d7fda77",
    "commit": "9f40f0e65bf1f465b59332c48af64fc1a1a80cd3"
  },
  "cast_at": "2026-10-19T18:07:55.778Z",
  "refs": [
    {
      "kind": "cli-command",
      "mode": "sidecar",
      "ref": "[[check-workflow-brief]]",
      "src": "content/cli/foundry/check-workflow-brief.md",
      "dst": "references/cli/check-workflow-brief.json",
      "used_at": "runtime",
      "load": "on-demand",
      "evidence": "hypothesis",
      "purpose": "Report declared blockers separately from structural validity.",
      "trigger": "After structural validation and before reporting whether the brief is clear of declared blockers.",
      "verification": "Check the committed fixtures and review a worked run for faithful evidence and unchanged brief input.",
      "src_hash": "7fd8bccdd0f5a2a62cc51e00589e9e263ce633a4c9a75ba3753d4d01ae822895",
      "dst_hash": "a5ad5bcca89d0e0db6f2e4503bf48cfec962c5282e89d2d9a3b3738eda11e8b3",
      "source": "deterministic"
    },
    {
      "kind": "cli-command",
      "mode": "sidecar",
      "ref": "[[validate-workflow-brief]]",
      "src": "content/cli/foundry/validate-workflow-brief.md",
      "dst": "references/cli/validate-workflow-brief.json",
      "used_at": "runtime",
      "load": "on-demand",
      "evidence": "hypothesis",
      "purpose": "Validate the emitted brief before returning it.",
      "trigger": "After writing workflow-brief.md.",
      "verification": "Check the committed fixtures and review a worked run for faithful evidence and unchanged brief input.",
      "src_hash": "3ddc9b59fb25189ac6d6c3cf9fb389c5292664e1effd13879a518af6f80d3e9c",
      "dst_hash": "f50a470d61ea5bc3863325cded80e7d008e200f7972a9e9e26fd9cbd082d01e4",
      "source": "deterministic"
    },
    {
      "kind": "research",
      "mode": "verbatim",
      "ref": "[[workflow-brief-design]]",
      "src": "content/research/workflow-brief-design/index.md",
      "dst": "references/notes/workflow-brief-design.md",
      "used_at": "runtime",
      "load": "upfront",
      "evidence": "hypothesis",
      "purpose": "Apply the brief boundaries: evidence and expert intent, no inferred Galaxy design, and separate workflow/environment blockers.",
      "verification": "Check the committed fixtures and review a worked run for faithful evidence and unchanged brief input.",
      "src_hash": "1f9ed280e7095839d3ca11a17bc32b7f02ff7c32942817be219968d1cdabec0c",
      "dst_hash": "1f9ed280e7095839d3ca11a17bc32b7f02ff7c32942817be219968d1cdabec0c",
      "source": "deterministic"
    },
    {
      "kind": "schema",
      "mode": "verbatim",
      "ref": "[[summary-nextflow]]",
      "src": "package://@galaxy-foundry/summarize-nextflow#summaryNextflowSchema",
      "dst": "references/schemas/summary-nextflow.schema.json",
      "used_at": "both",
      "load": "upfront",
      "evidence": "cast-validated",
      "purpose": "Read and validate the structured source evidence without turning its processes or containers into Galaxy choices.",
      "license": "MIT",
      "src_hash": "839e11b1892af74df3158377027e7d340a67dafdb9b5965d79e9715a1a109d54",
      "dst_hash": "839e11b1892af74df3158377027e7d340a67dafdb9b5965d79e9715a1a109d54",
      "source": "deterministic"
    },
    {
      "kind": "schema",
      "mode": "verbatim",
      "ref": "[[workflow-brief-schema]]",
      "src": "package://@galaxy-foundry/gxwf-foundry#workflowBriefSchema",
      "dst": "references/schemas/workflow-brief-schema.schema.json",
      "used_at": "both",
      "load": "upfront",
      "evidence": "cast-validated",
      "purpose": "Carry the Markdown section declaration and its structural validator.",
      "src_hash": "8e65acb789057c59f2fe3a2e7920682ad272a82e0caa92de69b62cc56d5036e0",
      "dst_hash": "8e65acb789057c59f2fe3a2e7920682ad272a82e0caa92de69b62cc56d5036e0",
      "source": "deterministic"
    }
  ],
  "artifacts": {
    "produces": [
      {
        "id": "workflow-brief",
        "kind": "markdown",
        "default_filename": "workflow-brief.md",
        "schema": "[[workflow-brief-schema]]",
        "description": "Expert-editable workflow intent and agent environment, with optional details and explicit workflow or environment blockers."
      }
    ],
    "consumes": [
      {
        "id": "summary-nextflow",
        "description": "Source evidence supplied by the preceding summarizer; preserve uncertainty and the caller’s selected scope.",
        "inherited_schema": "[[summary-nextflow]]",
        "producers": [
          "summarize-nextflow"
        ]
      }
    ]
  }
}
