{
  "provenance_schema_version": 4,
  "cast_target": "claude",
  "mold": {
    "name": "cwl-test-to-galaxy-test-plan",
    "path": "content/molds/cwl-test-to-galaxy-test-plan/index.md",
    "revision": 3,
    "content_hash": "b55214a0b2bf18e61a75a6c7aa32cf69992aa703480b754e067707dfc262813e",
    "commit": "a59d6025d612ce7013b09fa1ccb58f60507ccc6a"
  },
  "cast_at": "2026-10-26T16:18:39.955Z",
  "refs": [
    {
      "kind": "research",
      "mode": "verbatim",
      "ref": "[[galaxy-workflow-testability-design]]",
      "src": "content/research/galaxy-workflow-testability-design/index.md",
      "dst": "references/notes/galaxy-workflow-testability-design.md",
      "used_at": "runtime",
      "load": "on-demand",
      "evidence": "corpus-observed",
      "purpose": "Choose which workflow outputs and promoted checkpoints make meaningful assertions.",
      "trigger": "When deciding which outputs to assert and which labels the plan should bind to.",
      "src_hash": "c7dc5421bdd35af8000e61e618c813e162889416a0f322f8d0cb24a66ccad153",
      "dst_hash": "c7dc5421bdd35af8000e61e618c813e162889416a0f322f8d0cb24a66ccad153",
      "source": "deterministic"
    },
    {
      "kind": "research",
      "mode": "verbatim",
      "ref": "[[iwc-shortcuts-anti-patterns]]",
      "src": "content/research/iwc-shortcuts-anti-patterns/index.md",
      "dst": "references/notes/iwc-shortcuts-anti-patterns.md",
      "used_at": "runtime",
      "load": "on-demand",
      "evidence": "corpus-observed",
      "purpose": "Distinguish accepted IWC-style test shortcuts from assertion smells while translating tests.",
      "trigger": "When deciding whether to use existence-only, size-only, image-dimension, or tolerant output checks.",
      "src_hash": "b3f691a59751114ab67588832ba978052ab2be2ab5ef775737177ad45d7bdc45",
      "dst_hash": "b3f691a59751114ab67588832ba978052ab2be2ab5ef775737177ad45d7bdc45",
      "source": "deterministic"
    },
    {
      "kind": "research",
      "mode": "verbatim",
      "ref": "[[iwc-test-data-conventions]]",
      "src": "content/research/iwc-test-data-conventions/index.md",
      "dst": "references/notes/iwc-test-data-conventions.md",
      "used_at": "runtime",
      "load": "on-demand",
      "evidence": "corpus-observed",
      "purpose": "Emit Galaxy/IWC-style job input fixtures, remote locations, hashes, and collection input shapes.",
      "trigger": "When writing job inputs or deciding whether fixtures belong in test-data, Zenodo, ENA/SRA, or CVMFS.",
      "src_hash": "b7ef14132a0b40f626fff98fde44234ce5c848b6a3c255f4748b803c9a44b074",
      "dst_hash": "b7ef14132a0b40f626fff98fde44234ce5c848b6a3c255f4748b803c9a44b074",
      "source": "deterministic"
    },
    {
      "kind": "research",
      "mode": "verbatim",
      "ref": "[[planemo-asserts-idioms]]",
      "src": "content/research/planemo-asserts-idioms/index.md",
      "dst": "references/notes/planemo-asserts-idioms.md",
      "used_at": "runtime",
      "load": "on-demand",
      "evidence": "corpus-observed",
      "purpose": "Describe Galaxy workflow-test assertion intent and tolerances for translated expected outputs.",
      "trigger": "When turning CWL expected outputs into Galaxy test-plan assertions.",
      "src_hash": "9a6363854dcbeb01e1e590dc5bc0f5d7d0ec9675c4828ad2a8be8fa8022a61df",
      "dst_hash": "9a6363854dcbeb01e1e590dc5bc0f5d7d0ec9675c4828ad2a8be8fa8022a61df",
      "source": "deterministic"
    },
    {
      "kind": "research",
      "mode": "verbatim",
      "ref": "[[planemo-workflow-test-architecture]]",
      "src": "content/research/planemo-workflow-test-architecture/index.md",
      "dst": "references/notes/planemo-workflow-test-architecture.md",
      "used_at": "runtime",
      "load": "on-demand",
      "evidence": "corpus-observed",
      "purpose": "Keep the plan addressable by stable labels and artifacts Planemo can connect back to invocations, jobs, and outputs.",
      "trigger": "When recording the labels and checkpoints the downstream test must address.",
      "src_hash": "3b688f5a39951ad6f937335bf1217731aefc59fef7472fcbe9f85002019a2caf",
      "dst_hash": "3b688f5a39951ad6f937335bf1217731aefc59fef7472fcbe9f85002019a2caf",
      "source": "deterministic"
    },
    {
      "kind": "schema",
      "mode": "verbatim",
      "ref": "[[galaxy-workflow-test-plan]]",
      "src": "package://@galaxy-foundry/gxwf-foundry#galaxyWorkflowTestPlanSchema",
      "dst": "references/schemas/galaxy-workflow-test-plan.schema.json",
      "used_at": "runtime",
      "load": "upfront",
      "evidence": "hypothesis",
      "purpose": "Output contract: the emitted plan conforms to [[galaxy-workflow-test-plan]]. Cast bundles the JSON Schema; validate with `foundry validate-galaxy-workflow-test-plan`.",
      "verification": "Cast the skill on a CWL summary carrying tests and confirm the emitted YAML validates and downstream [[implement-galaxy-workflow-test]] consumes it.",
      "license": "MIT",
      "src_hash": "03fc1d58499c4bd5f3fa9556d771a8f24bcc8a387f120bd6eb28fe5f103ffc95",
      "dst_hash": "03fc1d58499c4bd5f3fa9556d771a8f24bcc8a387f120bd6eb28fe5f103ffc95",
      "source": "deterministic"
    },
    {
      "kind": "schema",
      "mode": "verbatim",
      "ref": "[[summary-cwl]]",
      "src": "package://@galaxy-foundry/gxwf-foundry#summaryCwlSchema",
      "dst": "references/schemas/summary-cwl.schema.json",
      "used_at": "runtime",
      "load": "upfront",
      "evidence": "corpus-observed",
      "purpose": "Read the CWL summary's test cases, job-file paths, expected-output references, and assertion evidence.",
      "license": "MIT",
      "src_hash": "6ba695858bcc32ef1bb1b0c9f61d8a3c1074848819b6077c50bec3c7b5f6c6ef",
      "dst_hash": "6ba695858bcc32ef1bb1b0c9f61d8a3c1074848819b6077c50bec3c7b5f6c6ef",
      "source": "deterministic"
    },
    {
      "kind": "schema",
      "mode": "verbatim",
      "ref": "[[tests-format]]",
      "src": "package://@galaxy-foundry/gxwf-foundry#testsFormatSchema",
      "dst": "references/schemas/tests-format.schema.json",
      "used_at": "runtime",
      "load": "on-demand",
      "evidence": "corpus-observed",
      "purpose": "Use the Galaxy workflow tests schema as the assertion-family vocabulary when translating CWL test evidence into a Galaxy test plan.",
      "trigger": "When mapping expected outputs, tolerances, or fixture assertions into Galaxy workflow-test assertion intent.",
      "license": "MIT",
      "license_file": "LICENSES/galaxy-tool-util-ts.LICENSE",
      "src_hash": "f86dd6a8111919264030609bab6ab970b015f6f66d324b5e2f721d4f62ab3cbc",
      "dst_hash": "f86dd6a8111919264030609bab6ab970b015f6f66d324b5e2f721d4f62ab3cbc",
      "source": "deterministic",
      "license_file_hash": "383450c494c01c466bcf22df102540a39ac89da50563fd7be686ba06772f96b3"
    }
  ],
  "artifacts": {
    "produces": [
      {
        "id": "galaxy-test-plan",
        "kind": "yaml",
        "default_filename": "galaxy-test-plan.yml",
        "schema": "[[galaxy-workflow-test-plan]]",
        "description": "Reviewable Galaxy workflow test plan (see [[galaxy-workflow-test-plan]]) derived from CWL test fixtures, job inputs, expected outputs, and assertion evidence."
      }
    ],
    "consumes": [
      {
        "id": "summary-cwl",
        "description": "Structured CWL summary from [[summarize-cwl]]; lists discovered test cases, job-file paths, and expected-output references.",
        "inherited_schema": "[[summary-cwl]]",
        "producers": [
          "summarize-cwl"
        ]
      }
    ]
  }
}
