{
  "provenance_schema_version": 4,
  "cast_target": "claude",
  "mold": {
    "name": "summary-to-cwl-template",
    "path": "content/molds/summary-to-cwl-template/index.md",
    "revision": 2,
    "content_hash": "c33d8e3332f5794e0d836a02cb24855ac7f911d94d220d55f9f23fec44b7f65f",
    "commit": "63a3f9cf9c97a637fe1628d298e524f35709e289"
  },
  "cast_at": "2026-09-13T20:58:30.210Z",
  "refs": [],
  "artifacts": {
    "produces": [
      {
        "id": "cwl-workflow-draft",
        "kind": "yaml",
        "default_filename": "cwl-workflow-draft.cwl",
        "description": "CWL Workflow skeleton: inputs, outputs, placeholder steps, rough connections, TODO slots for later implementation Molds."
      }
    ],
    "consumes": []
  }
}
